{
  "schemaVersion": "1.0",
  "packageId": "swk-rfl-g7-u03-l06",
  "lessonId": "ma-g7-ready-for-life-u03-l06",
  "scoringAuthority": {
    "kind": "RUBRIC",
    "criteria": [
      {
        "dimension": "Storage practice",
        "levels": [
          {
            "label": "Emerging",
            "descriptor": "Leftover or perishable food is not actually stored during the lesson, or timing and container choice are not reported."
          },
          {
            "label": "Proficient",
            "descriptor": "Real leftover or perishable food is stored promptly in a suitable container, with timing and container choice reported accurately."
          },
          {
            "label": "Advanced",
            "descriptor": "Same as proficient, and the learner identifies and corrects a specific past storage habit during this attempt."
          }
        ]
      },
      {
        "dimension": "Cleanup completeness",
        "levels": [
          {
            "label": "Emerging",
            "descriptor": "Only some surfaces, dishes, or utensils actually used are cleaned, or the list reported does not match a real prep area."
          },
          {
            "label": "Proficient",
            "descriptor": "Every real surface, dish, and utensil used is cleaned and listed specifically."
          },
          {
            "label": "Advanced",
            "descriptor": "Same as proficient, and the learner names a specific step they would normally skip but completed for this lesson, explaining why it matters."
          }
        ]
      }
    ],
    "lookFors": [
      "The storage and cleanup described are tied to a real meal or snack actually prepared or eaten, not an invented example.",
      "The final reflection connects back to the specific habit named at the start of the lesson rather than a general statement about cleaning up.",
      "A learner who completed the simulation/equal-credit alternative instead of the real-world version should be scored on this same rubric using the alternative submission as the evidence — using the sanctioned alternative is not itself a reason to score lower."
    ]
  },
  "completionAuthority": "learner",
  "nonDiagnosticGuard": "Do not infer effort, motivation, diagnosis, or character from an error."
}
